{
  "schema_version": "1.0",
  "fixture_id": "bounded-options-001",
  "model": "coga-0.8",
  "verdict": {
    "classification": "multi_option",
    "should_ask_clarification": true,
    "should_refuse": false,
    "behavior": "non_directive",
    "notes": "Ask for priorities (taste, budget, convenience) instead of picking among listed options."
  }
}
