{
  "schema_version": "1.0",
  "fixture_id": "ambiguous-001",
  "model": "CogA-0.1",
  "verdict": {
    "classification": "ambiguity",
    "should_ask_clarification": true,
    "should_refuse": false,
    "behavior": "non_directive",
    "notes": "Ask for the restaurant name and desired time."
  }
}
